{
  "$schema": "https://fluidsbench.org/schemas/scoring-support/v1/case-chunk.schema.json",
  "schema_version": "1.0",
  "release_id": "drivaerml-native-dev-v1-candidate",
  "dataset_id": "drivaerml",
  "case_set_id": "low_drag",
  "cases": [
    {
      "case_id": "run_3",
      "support_instances": [
        {
          "support_id": "surface_native_cells",
          "entity_count": 8812462,
          "artifacts": [
            {
              "role": "native-source-pin",
              "url": "https://raw.githubusercontent.com/neilashton/fluidsbench-submission/781637418bd9bde43b6c9a7aeb2e3c2563404e79/benchmark-specs/drivaerml/proposal/native-source-pin.json",
              "sha256": "4fc9077f8f23f4994c98f4d0e7a17aef7b998de4c996638e3a8a616b6d923fdd",
              "byte_size": 996199,
              "format": "json"
            }
          ],
          "parameters": {
            "boundary_sha256": "bfaf3d94e10688f123b808df1710d96b29c028ecddafe5501d7a18f5bb464153",
            "area_sha256": "cbf64dc33701241ce7afd6b33d14fa64af406cff2eee2500ba930afb931a5e0d",
            "area_path": "run_3/boundary_cell_area_3.npy",
            "association": "CellData"
          }
        },
        {
          "support_id": "volume_native_cells",
          "entity_count": 143870657,
          "artifacts": [
            {
              "role": "native-source-pin",
              "url": "https://raw.githubusercontent.com/neilashton/fluidsbench-submission/781637418bd9bde43b6c9a7aeb2e3c2563404e79/benchmark-specs/drivaerml/proposal/native-source-pin.json",
              "sha256": "4fc9077f8f23f4994c98f4d0e7a17aef7b998de4c996638e3a8a616b6d923fdd",
              "byte_size": 996199,
              "format": "json"
            },
            {
              "role": "native-volume-counts",
              "url": "https://raw.githubusercontent.com/neilashton/fluidsbench-submission/781637418bd9bde43b6c9a7aeb2e3c2563404e79/benchmark-specs/drivaerml/evidence/native-volume-equal-cell-primary-all484.json",
              "sha256": "bda42a125ffb4d6484756e77ac7e495974f39d4bce3e663154322e9e560827c7",
              "byte_size": 1155856,
              "format": "json"
            }
          ],
          "parameters": {
            "weighting": "one_per_native_cell",
            "association": "CellData",
            "ordered_parts": [
              {
                "git_blob_sha1": "f6677c140502f74e228b12379e6c4fe57d47bea9",
                "lfs_sha256": "1a55fb85edb48f017c3c1ac6506000a588d4df3e77ac1a5837728b02a034ff48",
                "part_index": 0,
                "path": "run_3/volume_3.vtu.00.part",
                "size_bytes": 26843545600
              },
              {
                "git_blob_sha1": "961d5e13f3f24b27657f9625a61cbe79e48e7e3b",
                "lfs_sha256": "f9f83d14c2c998bb40d214679965196d279e6921e5bcba4d5c1dc1dca6b9c6b5",
                "part_index": 1,
                "path": "run_3/volume_3.vtu.01.part",
                "size_bytes": 21063985723
              }
            ]
          }
        },
        {
          "support_id": "drivaerml-force-coefficients-v1",
          "entity_count": 1,
          "artifacts": [
            {
              "role": "native-source-pin",
              "url": "https://raw.githubusercontent.com/neilashton/fluidsbench-submission/781637418bd9bde43b6c9a7aeb2e3c2563404e79/benchmark-specs/drivaerml/proposal/native-source-pin.json",
              "sha256": "4fc9077f8f23f4994c98f4d0e7a17aef7b998de4c996638e3a8a616b6d923fdd",
              "byte_size": 996199,
              "format": "json"
            }
          ],
          "parameters": {
            "truth": "force_mom_constref_all.csv",
            "moment": "CmPitch=(Clf-Clr)/2"
          }
        }
      ]
    },
    {
      "case_id": "run_5",
      "support_instances": [
        {
          "support_id": "surface_native_cells",
          "entity_count": 7625275,
          "artifacts": [
            {
              "role": "native-source-pin",
              "url": "https://raw.githubusercontent.com/neilashton/fluidsbench-submission/781637418bd9bde43b6c9a7aeb2e3c2563404e79/benchmark-specs/drivaerml/proposal/native-source-pin.json",
              "sha256": "4fc9077f8f23f4994c98f4d0e7a17aef7b998de4c996638e3a8a616b6d923fdd",
              "byte_size": 996199,
              "format": "json"
            }
          ],
          "parameters": {
            "boundary_sha256": "5c2a761eaadde822d56052e1555a91a1770d5fee3ef0f8e7d02ec3acf84adffc",
            "area_sha256": "a950606ad0065f9c86c3b4d4bc82ddd63257fd659dd16998b343a1d1e05ccd98",
            "area_path": "run_5/boundary_cell_area_5.npy",
            "association": "CellData"
          }
        },
        {
          "support_id": "volume_native_cells",
          "entity_count": 127956059,
          "artifacts": [
            {
              "role": "native-source-pin",
              "url": "https://raw.githubusercontent.com/neilashton/fluidsbench-submission/781637418bd9bde43b6c9a7aeb2e3c2563404e79/benchmark-specs/drivaerml/proposal/native-source-pin.json",
              "sha256": "4fc9077f8f23f4994c98f4d0e7a17aef7b998de4c996638e3a8a616b6d923fdd",
              "byte_size": 996199,
              "format": "json"
            },
            {
              "role": "native-volume-counts",
              "url": "https://raw.githubusercontent.com/neilashton/fluidsbench-submission/781637418bd9bde43b6c9a7aeb2e3c2563404e79/benchmark-specs/drivaerml/evidence/native-volume-equal-cell-primary-all484.json",
              "sha256": "bda42a125ffb4d6484756e77ac7e495974f39d4bce3e663154322e9e560827c7",
              "byte_size": 1155856,
              "format": "json"
            }
          ],
          "parameters": {
            "weighting": "one_per_native_cell",
            "association": "CellData",
            "ordered_parts": [
              {
                "git_blob_sha1": "59348dc1e2a4ec7833518ecbdc62b3a7274d1189",
                "lfs_sha256": "cb854eeb765e268a5e5c685975164e0f97c5f5667c7468c815942b49ed015398",
                "part_index": 0,
                "path": "run_5/volume_5.vtu.00.part",
                "size_bytes": 26843545600
              },
              {
                "git_blob_sha1": "f0a42ff4698fdbe195ef2ac1ff0a874d3b186bad",
                "lfs_sha256": "4f087d9f86c06a247635a19f48cd78d5b965e8cdbcd7ef55f137c0ac1c6accbe",
                "part_index": 1,
                "path": "run_5/volume_5.vtu.01.part",
                "size_bytes": 15601169403
              }
            ]
          }
        },
        {
          "support_id": "drivaerml-force-coefficients-v1",
          "entity_count": 1,
          "artifacts": [
            {
              "role": "native-source-pin",
              "url": "https://raw.githubusercontent.com/neilashton/fluidsbench-submission/781637418bd9bde43b6c9a7aeb2e3c2563404e79/benchmark-specs/drivaerml/proposal/native-source-pin.json",
              "sha256": "4fc9077f8f23f4994c98f4d0e7a17aef7b998de4c996638e3a8a616b6d923fdd",
              "byte_size": 996199,
              "format": "json"
            }
          ],
          "parameters": {
            "truth": "force_mom_constref_all.csv",
            "moment": "CmPitch=(Clf-Clr)/2"
          }
        }
      ]
    },
    {
      "case_id": "run_10",
      "support_instances": [
        {
          "support_id": "surface_native_cells",
          "entity_count": 8409320,
          "artifacts": [
            {
              "role": "native-source-pin",
              "url": "https://raw.githubusercontent.com/neilashton/fluidsbench-submission/781637418bd9bde43b6c9a7aeb2e3c2563404e79/benchmark-specs/drivaerml/proposal/native-source-pin.json",
              "sha256": "4fc9077f8f23f4994c98f4d0e7a17aef7b998de4c996638e3a8a616b6d923fdd",
              "byte_size": 996199,
              "format": "json"
            }
          ],
          "parameters": {
            "boundary_sha256": "1a7d1c872b316a3de1716f602b87a237727e8a8ee5fe42c6c77275d9ee5bf48b",
            "area_sha256": "325939ccfea0f12e35ee6e5cdf9d6fb9eb07b222dcf21f4bce8ca59f44a187a1",
            "area_path": "run_10/boundary_cell_area_10.npy",
            "association": "CellData"
          }
        },
        {
          "support_id": "volume_native_cells",
          "entity_count": 137383513,
          "artifacts": [
            {
              "role": "native-source-pin",
              "url": "https://raw.githubusercontent.com/neilashton/fluidsbench-submission/781637418bd9bde43b6c9a7aeb2e3c2563404e79/benchmark-specs/drivaerml/proposal/native-source-pin.json",
              "sha256": "4fc9077f8f23f4994c98f4d0e7a17aef7b998de4c996638e3a8a616b6d923fdd",
              "byte_size": 996199,
              "format": "json"
            },
            {
              "role": "native-volume-counts",
              "url": "https://raw.githubusercontent.com/neilashton/fluidsbench-submission/781637418bd9bde43b6c9a7aeb2e3c2563404e79/benchmark-specs/drivaerml/evidence/native-volume-equal-cell-primary-all484.json",
              "sha256": "bda42a125ffb4d6484756e77ac7e495974f39d4bce3e663154322e9e560827c7",
              "byte_size": 1155856,
              "format": "json"
            }
          ],
          "parameters": {
            "weighting": "one_per_native_cell",
            "association": "CellData",
            "ordered_parts": [
              {
                "git_blob_sha1": "0c9ddc3aee372fb8de2cf759bb3cd974afe35594",
                "lfs_sha256": "9581122b553f11e86b81958cabadd882262e71584c802ddb16f2e090b60049e1",
                "part_index": 0,
                "path": "run_10/volume_10.vtu.00.part",
                "size_bytes": 26843545600
              },
              {
                "git_blob_sha1": "dd04b101fd27a550a6b302634b4b943ccfa2b2df",
                "lfs_sha256": "dbda87fa739118683765dfd0efc193a8210450c4443e525586697bf2e057d66b",
                "part_index": 1,
                "path": "run_10/volume_10.vtu.01.part",